[
  {
    "schemaVersion": "kaoyan-existing-vocabulary-1.0",
    "source": "rebuilt",
    "articleKey": "ky-en1-2011-r-t1",
    "surface": "appointment",
    "word": "appointment",
    "ipa": "/əˈpɔɪntmənt/",
    "pos": "n.",
    "sourceLocation": "P1-S1",
    "contextMeaning": "任命，委任职位",
    "examMeaning": "任命；约定；职位",
    "collocationOrDerivation": "his appointment as director / appoint v.",
    "frequencyRating": "★★★",
    "isSelfAnnotated": null,
    "rawFields": {
      "isInObstacleList": true
    },
    "provenance": {
      "sourceLayer": "rebuilt",
      "sourceFile": "rebuilt_data/single_texts/text_2011_t1.json",
      "year": 2011,
      "articleKey": "ky-en1-2011-r-t1",
      "extractedAt": "2026-09-18T23:13:00+0800",
      "contentHash": "sha256:df052a1f05b1ccdb02d7a5b6086e54408c4e4f349f4db04b34f6df5c4dace128"
    }
  },
  {
    "schemaVersion": "kaoyan-existing-vocabulary-1.0",
    "source": "rebuilt",
    "articleKey": "ky-en1-2011-r-t1",
    "surface": "favorable",
    "word": "favorable",
    "ipa": "/ˈfeɪvərəbl/",
    "pos": "adj.",
    "sourceLocation": "P1-S2",
    "contextMeaning": "积极赞许的，有利的",
    "examMeaning": "赞同的；有利的；讨人喜欢的",
    "collocationOrDerivation": "the response has been favorable ↔ received acclaim",
    "frequencyRating": "★★★",
    "isSelfAnnotated": null,
    "rawFields": {
      "isInObstacleList": true
    },
    "provenance": {
      "sourceLayer": "rebuilt",
      "sourceFile": "rebuilt_data/single_texts/text_2011_t1.json",
      "year": 2011,
      "articleKey": "ky-en1-2011-r-t1",
      "extractedAt": "2026-09-18T23:13:00+0800",
      "contentHash": "sha256:df052a1f05b1ccdb02d7a5b6086e54408c4e4f349f4db04b34f6df5c4dace128"
    }
  },
  {
    "schemaVersion": "kaoyan-existing-vocabulary-1.0",
    "source": "rebuilt",
    "articleKey": "ky-en1-2011-r-t1",
    "surface": "sober-sided",
    "word": "sober-sided",
    "ipa": "/ˈsəʊbəˌsaɪdɪd/",
    "pos": "adj.",
    "sourceLocation": "P1-S3",
    "contextMeaning": "严肃认真的，持重稳健的",
    "examMeaning": "严肃持重的；严谨的",
    "collocationOrDerivation": "a sober-sided critic / sober adj. 清醒的",
    "frequencyRating": "★★",
    "isSelfAnnotated": null,
    "rawFields": {
      "isInObstacleList": true
    },
    "provenance": {
      "sourceLayer": "rebuilt",
      "sourceFile": "rebuilt_data/single_texts/text_2011_t1.json",
      "year": 2011,
      "articleKey": "ky-en1-2011-r-t1",
      "extractedAt": "2026-09-18T23:13:00+0800",
      "contentHash": "sha256:df052a1f05b1ccdb02d7a5b6086e54408c4e4f349f4db04b34f6df5c4dace128"
    }
  },
  {
    "schemaVersion": "kaoyan-existing-vocabulary-1.0",
    "source": "rebuilt",
    "articleKey": "ky-en1-2011-r-t1",
    "surface": "unpretentious",
    "word": "unpretentious",
    "ipa": "/ˌʌnprɪˈtenʃəs/",
    "pos": "adj.",
    "sourceLocation": "P2-S2",
    "contextMeaning": "不装腔作势的，谦逊朴实的",
    "examMeaning": "谦虚朴实的；不矫揉造作的",
    "collocationOrDerivation": "an unpretentious musician ↔ modest (Q22正确项)",
    "frequencyRating": "★★★",
    "isSelfAnnotated": null,
    "rawFields": {
      "isInObstacleList": true
    },
    "provenance": {
      "sourceLayer": "rebuilt",
      "sourceFile": "rebuilt_data/single_texts/text_2011_t1.json",
      "year": 2011,
      "articleKey": "ky-en1-2011-r-t1",
      "extractedAt": "2026-09-18T23:13:00+0800",
      "contentHash": "sha256:df052a1f05b1ccdb02d7a5b6086e54408c4e4f349f4db04b34f6df5c4dace128"
    }
  },
  {
    "schemaVersion": "kaoyan-existing-vocabulary-1.0",
    "source": "rebuilt",
    "articleKey": "ky-en1-2011-r-t1",
    "surface": "formidable",
    "word": "formidable",
    "ipa": "/ˈfɔːmɪdəbl/",
    "pos": "adj.",
    "sourceLocation": "P2-S2",
    "contextMeaning": "令人敬畏的，威风凛凛的",
    "examMeaning": "令人敬畏的；可怕的；难对付的",
    "collocationOrDerivation": "formidable conductor / formidable challenge",
    "frequencyRating": "★★★",
    "isSelfAnnotated": null,
    "rawFields": {
      "isInObstacleList": true
    },
    "provenance": {
      "sourceLayer": "rebuilt",
      "sourceFile": "rebuilt_data/single_texts/text_2011_t1.json",
      "year": 2011,
      "articleKey": "ky-en1-2011-r-t1",
      "extractedAt": "2026-09-18T23:13:00+0800",
      "contentHash": "sha256:df052a1f05b1ccdb02d7a5b6086e54408c4e4f349f4db04b34f6df5c4dace128"
    }
  },
  {
    "schemaVersion": "kaoyan-existing-vocabulary-1.0",
    "source": "rebuilt",
    "articleKey": "ky-en1-2011-r-t1",
    "surface": "hitherto",
    "word": "hitherto",
    "ipa": "/ˌhɪðəˈtuː/",
    "pos": "adv.",
    "sourceLocation": "P2-S3",
    "contextMeaning": "迄今为止，到目前为止",
    "examMeaning": "迄今；到那时为止",
    "collocationOrDerivation": "hitherto been led by",
    "frequencyRating": "★★",
    "isSelfAnnotated": null,
    "rawFields": {
      "isInObstacleList": true
    },
    "provenance": {
      "sourceLayer": "rebuilt",
      "sourceFile": "rebuilt_data/single_texts/text_2011_t1.json",
      "year": 2011,
      "articleKey": "ky-en1-2011-r-t1",
      "extractedAt": "2026-09-18T23:13:00+0800",
      "contentHash": "sha256:df052a1f05b1ccdb02d7a5b6086e54408c4e4f349f4db04b34f6df5c4dace128"
    }
  },
  {
    "schemaVersion": "kaoyan-existing-vocabulary-1.0",
    "source": "rebuilt",
    "articleKey": "ky-en1-2011-r-t1",
    "surface": "faint",
    "word": "faint",
    "ipa": "/feɪnt/",
    "pos": "adj.",
    "sourceLocation": "P2-S3",
    "contextMeaning": "微弱的，勉强的",
    "examMeaning": "微弱的；虚弱的；敷衍的",
    "collocationOrDerivation": "faint praise（明褒实贬/微弱的赞美）",
    "frequencyRating": "★★",
    "isSelfAnnotated": null,
    "rawFields": {
      "isInObstacleList": true
    },
    "provenance": {
      "sourceLayer": "rebuilt",
      "sourceFile": "rebuilt_data/single_texts/text_2011_t1.json",
      "year": 2011,
      "articleKey": "ky-en1-2011-r-t1",
      "extractedAt": "2026-09-18T23:13:00+0800",
      "contentHash": "sha256:df052a1f05b1ccdb02d7a5b6086e54408c4e4f349f4db04b34f6df5c4dace128"
    }
  },
  {
    "schemaVersion": "kaoyan-existing-vocabulary-1.0",
    "source": "rebuilt",
    "articleKey": "ky-en1-2011-r-t1",
    "surface": "repertoire",
    "word": "repertoire",
    "ipa": "/ˈrepətwɑː/",
    "pos": "n.",
    "sourceLocation": "P5-S4",
    "contextMeaning": "（全部演出的）曲目库，保留剧目",
    "examMeaning": "全部曲目；全部才能",
    "collocationOrDerivation": "orchestra's repertoire / expand the repertoire",
    "frequencyRating": "★★",
    "isSelfAnnotated": null,
    "rawFields": {
      "isInObstacleList": true
    },
    "provenance": {
      "sourceLayer": "rebuilt",
      "sourceFile": "rebuilt_data/single_texts/text_2011_t1.json",
      "year": 2011,
      "articleKey": "ky-en1-2011-r-t1",
      "extractedAt": "2026-09-18T23:13:00+0800",
      "contentHash": "sha256:df052a1f05b1ccdb02d7a5b6086e54408c4e4f349f4db04b34f6df5c4dace128"
    }
  },
  {
    "schemaVersion": "kaoyan-existing-vocabulary-1.0",
    "source": "rebuilt",
    "articleKey": "ky-en1-2011-r-t1",
    "surface": "vibrant",
    "word": "vibrant",
    "ipa": "/ˈvaɪbrənt/",
    "pos": "adj.",
    "sourceLocation": "P5-S2",
    "contextMeaning": "充满生机的，生机勃勃的",
    "examMeaning": "振动的；精力充沛的；鲜艳的",
    "collocationOrDerivation": "more vibrant organization",
    "frequencyRating": "★★",
    "isSelfAnnotated": null,
    "rawFields": {
      "isInObstacleList": true
    },
    "provenance": {
      "sourceLayer": "rebuilt",
      "sourceFile": "rebuilt_data/single_texts/text_2011_t1.json",
      "year": 2011,
      "articleKey": "ky-en1-2011-r-t1",
      "extractedAt": "2026-09-18T23:13:00+0800",
      "contentHash": "sha256:df052a1f05b1ccdb02d7a5b6086e54408c4e4f349f4db04b34f6df5c4dace128"
    }
  }
]