[
  {
    "schemaVersion": "kaoyan-existing-vocabulary-1.0",
    "source": "rebuilt",
    "articleKey": "ky-en1-2010-r-t3",
    "surface": "epidemic",
    "word": "epidemic",
    "ipa": "/ˌepɪˈdemɪk/",
    "pos": "n./adj.",
    "sourceLocation": "P1-S1",
    "contextMeaning": "（风潮等）泛滥，流行；流行病",
    "examMeaning": "流行病；泛滥；蔓延",
    "collocationOrDerivation": "social epidemics / epidemic spread",
    "frequencyRating": "★★★",
    "isSelfAnnotated": null,
    "rawFields": {
      "isInObstacleList": true
    },
    "provenance": {
      "sourceLayer": "rebuilt",
      "sourceFile": "rebuilt_data/single_texts/text_2010_t3.json",
      "year": 2010,
      "articleKey": "ky-en1-2010-r-t3",
      "extractedAt": "2026-09-18T23:13:00+0800",
      "contentHash": "sha256:468cd0dbaa5cf3e8d7307e8b7311e2d19636fd6028c335be4f34a0994d97308d"
    }
  },
  {
    "schemaVersion": "kaoyan-existing-vocabulary-1.0",
    "source": "rebuilt",
    "articleKey": "ky-en1-2010-r-t3",
    "surface": "influential",
    "word": "influential",
    "ipa": "/ˌɪnfluˈenʃl/",
    "pos": "n./adj.",
    "sourceLocation": "P1-S1",
    "contextMeaning": "意见领袖，有影响力的人物",
    "examMeaning": "有很大影响力的；名人",
    "collocationOrDerivation": "special influentials / highly influential",
    "frequencyRating": "★★★",
    "isSelfAnnotated": null,
    "rawFields": {
      "isInObstacleList": true
    },
    "provenance": {
      "sourceLayer": "rebuilt",
      "sourceFile": "rebuilt_data/single_texts/text_2010_t3.json",
      "year": 2010,
      "articleKey": "ky-en1-2010-r-t3",
      "extractedAt": "2026-09-18T23:13:00+0800",
      "contentHash": "sha256:468cd0dbaa5cf3e8d7307e8b7311e2d19636fd6028c335be4f34a0994d97308d"
    }
  },
  {
    "schemaVersion": "kaoyan-existing-vocabulary-1.0",
    "source": "rebuilt",
    "articleKey": "ky-en1-2010-r-t3",
    "surface": "persuasive",
    "word": "persuasive",
    "ipa": "/pəˈsweɪsɪv/",
    "pos": "adj.",
    "sourceLocation": "P1-S1",
    "contextMeaning": "有说服力的，劝导性的",
    "examMeaning": "具说服力的；令人信服的",
    "collocationOrDerivation": "persuade v. / persuasiveness n.",
    "frequencyRating": "★★",
    "isSelfAnnotated": null,
    "rawFields": {
      "isInObstacleList": true
    },
    "provenance": {
      "sourceLayer": "rebuilt",
      "sourceFile": "rebuilt_data/single_texts/text_2010_t3.json",
      "year": 2010,
      "articleKey": "ky-en1-2010-r-t3",
      "extractedAt": "2026-09-18T23:13:00+0800",
      "contentHash": "sha256:468cd0dbaa5cf3e8d7307e8b7311e2d19636fd6028c335be4f34a0994d97308d"
    }
  },
  {
    "schemaVersion": "kaoyan-existing-vocabulary-1.0",
    "source": "rebuilt",
    "articleKey": "ky-en1-2010-r-t3",
    "surface": "threshold",
    "word": "threshold",
    "ipa": "/ˈθreʃhəʊld/",
    "pos": "n.",
    "sourceLocation": "P1-S2",
    "contextMeaning": "阈值，门槛，临界点",
    "examMeaning": "门槛；界限；端点",
    "collocationOrDerivation": "cross a threshold / on the threshold of",
    "frequencyRating": "★★",
    "isSelfAnnotated": null,
    "rawFields": {
      "isInObstacleList": true
    },
    "provenance": {
      "sourceLayer": "rebuilt",
      "sourceFile": "rebuilt_data/single_texts/text_2010_t3.json",
      "year": 2010,
      "articleKey": "ky-en1-2010-r-t3",
      "extractedAt": "2026-09-18T23:13:00+0800",
      "contentHash": "sha256:468cd0dbaa5cf3e8d7307e8b7311e2d19636fd6028c335be4f34a0994d97308d"
    }
  },
  {
    "schemaVersion": "kaoyan-existing-vocabulary-1.0",
    "source": "rebuilt",
    "articleKey": "ky-en1-2010-r-t3",
    "surface": "plausible",
    "word": "plausible",
    "ipa": "/ˈplɔːzəbl/",
    "pos": "adj.",
    "sourceLocation": "P2-S1",
    "contextMeaning": "貌似合情合理的，听起来可信的",
    "examMeaning": "似是而非的；貌似合理的",
    "collocationOrDerivation": "plausible-sounding / plausibility n.",
    "frequencyRating": "★★★",
    "isSelfAnnotated": null,
    "rawFields": {
      "isInObstacleList": true
    },
    "provenance": {
      "sourceLayer": "rebuilt",
      "sourceFile": "rebuilt_data/single_texts/text_2010_t3.json",
      "year": 2010,
      "articleKey": "ky-en1-2010-r-t3",
      "extractedAt": "2026-09-18T23:13:00+0800",
      "contentHash": "sha256:468cd0dbaa5cf3e8d7307e8b7311e2d19636fd6028c335be4f34a0994d97308d"
    }
  },
  {
    "schemaVersion": "kaoyan-existing-vocabulary-1.0",
    "source": "rebuilt",
    "articleKey": "ky-en1-2010-r-t3",
    "surface": "virulent",
    "word": "virulent",
    "ipa": "/ˈvɪrələnt/",
    "pos": "adj.",
    "sourceLocation": "P2-S2",
    "contextMeaning": "剧毒的，致命的，极恶意的",
    "examMeaning": "恶性的；致死的；凶猛的",
    "collocationOrDerivation": "a virulent disease / virulence n.",
    "frequencyRating": "★",
    "isSelfAnnotated": null,
    "rawFields": {
      "isInObstacleList": true
    },
    "provenance": {
      "sourceLayer": "rebuilt",
      "sourceFile": "rebuilt_data/single_texts/text_2010_t3.json",
      "year": 2010,
      "articleKey": "ky-en1-2010-r-t3",
      "extractedAt": "2026-09-18T23:13:00+0800",
      "contentHash": "sha256:468cd0dbaa5cf3e8d7307e8b7311e2d19636fd6028c335be4f34a0994d97308d"
    }
  },
  {
    "schemaVersion": "kaoyan-existing-vocabulary-1.0",
    "source": "rebuilt",
    "articleKey": "ky-en1-2010-r-t3",
    "surface": "proponent",
    "word": "proponent",
    "ipa": "/prəˈpəʊnənt/",
    "pos": "n.",
    "sourceLocation": "P2-S3",
    "contextMeaning": "倡导者，支持者",
    "examMeaning": "拥护者；建议者",
    "collocationOrDerivation": "proponents of the theory",
    "frequencyRating": "★★",
    "isSelfAnnotated": null,
    "rawFields": {
      "isInObstacleList": true
    },
    "provenance": {
      "sourceLayer": "rebuilt",
      "sourceFile": "rebuilt_data/single_texts/text_2010_t3.json",
      "year": 2010,
      "articleKey": "ky-en1-2010-r-t3",
      "extractedAt": "2026-09-18T23:13:00+0800",
      "contentHash": "sha256:468cd0dbaa5cf3e8d7307e8b7311e2d19636fd6028c335be4f34a0994d97308d"
    }
  },
  {
    "schemaVersion": "kaoyan-existing-vocabulary-1.0",
    "source": "rebuilt",
    "articleKey": "ky-en1-2010-r-t3",
    "surface": "cascade",
    "word": "cascade",
    "ipa": "/kæˈskeɪd/",
    "pos": "v./n.",
    "sourceLocation": "P4-S3",
    "contextMeaning": "如瀑布般级联扩散；级联反应",
    "examMeaning": "瀑布；串联传播；逐级下垂",
    "collocationOrDerivation": "cascade through a network / creating a cascade",
    "frequencyRating": "★★",
    "isSelfAnnotated": null,
    "rawFields": {
      "isInObstacleList": true
    },
    "provenance": {
      "sourceLayer": "rebuilt",
      "sourceFile": "rebuilt_data/single_texts/text_2010_t3.json",
      "year": 2010,
      "articleKey": "ky-en1-2010-r-t3",
      "extractedAt": "2026-09-18T23:13:00+0800",
      "contentHash": "sha256:468cd0dbaa5cf3e8d7307e8b7311e2d19636fd6028c335be4f34a0994d97308d"
    }
  },
  {
    "schemaVersion": "kaoyan-existing-vocabulary-1.0",
    "source": "rebuilt",
    "articleKey": "ky-en1-2010-r-t3",
    "surface": "susceptible",
    "word": "susceptible",
    "ipa": "/səˈseptəbl/",
    "pos": "adj.",
    "sourceLocation": "P5-S1",
    "contextMeaning": "易感易受影响的，敏感脆弱的",
    "examMeaning": "易受影响的；易感染的",
    "collocationOrDerivation": "susceptible people ↔ receptive individuals",
    "frequencyRating": "★★★",
    "isSelfAnnotated": null,
    "rawFields": {
      "isInObstacleList": true
    },
    "provenance": {
      "sourceLayer": "rebuilt",
      "sourceFile": "rebuilt_data/single_texts/text_2010_t3.json",
      "year": 2010,
      "articleKey": "ky-en1-2010-r-t3",
      "extractedAt": "2026-09-18T23:13:00+0800",
      "contentHash": "sha256:468cd0dbaa5cf3e8d7307e8b7311e2d19636fd6028c335be4f34a0994d97308d"
    }
  }
]